{
    "background_color": "hsl(180, 100%, 96%)",
    "osm_text_key": "model",
    "osm_wikidata_keys": [
        "model:wikidata"
    ],
    "osm_wikidata_properties": [
        "P31"
    ],
    "require_wikidata_link": true,
    "linked_entity_filter_classes": [
        "Q19832486",
        "Q45296117",
        "Q15056995",
        "Q15056993",
        "Q111722634",
        "Q110055303"
    ]
}