{
    "background_color": "hsl(150, 100%, 96%)",
    "fetch_parts_of_linked_entities": true,
    "mapcomplete_theme": "trees",
    "osm_text_key": "species",
    "osm_wikidata_keys": [
        "species:wikidata"
    ],
    "osm_wikidata_properties": [
        "P10241"
    ],
    "require_wikidata_link": true,
    "use_min_zoom_level": true
}