{
    "background_color": "hsl(30, 100%, 96%)",
    "fetch_parts_of_linked_entities": true,
    "mapcomplete_theme": "artwork",
    "osm_filter_tags": [
        "artist:wikidata",
        "artist_name",
        "tourism",
        "historic",
        "amenity=fountain"
    ],
    "osm_text_key": "artist_name",
    "osm_wikidata_keys": [
        "artist:wikidata"
    ],
    "osm_wikidata_properties": [
        "P170",
        "P50"
    ],
    "require_wikidata_link": true
}