{
  "background_color": "hsl(90, 100%, 96%)",
  "fetch_parts_of_linked_entities": true,
  "ignore_big_elements": true,
  "mapcomplete_theme": "etymology",
  "osm_filter_tags": [
    "name:etymology:wikidata",
    "name:etymology",
    "name=*"
  ],
  "osm_text_key": "name:etymology",
  "osm_description_key": "name:etymology:description",
  "osm_wikidata_keys": [
    "name:etymology:wikidata",
    "subject:wikidata"
  ],
  "osm_wikidata_properties": [
    "P138",
    "P825",
    "P547"
  ],
  "relation_propagation_role": "street",
  "require_wikidata_link": true,
  "use_min_zoom_level": true
}