{
  "background_color": "hsl(240, 100%, 96%)",
  "ignore_big_elements": true,
  "osm_filter_tags": [
    "operator:wikidata",
    "operator",
    "amenity"
  ],
  "osm_text_key": "operator",
  "osm_wikidata_keys": [
    "operator:wikidata"
  ],
  "osm_wikidata_properties": [
    "P126",
    "P137"
  ],
  "require_wikidata_link": true,
  "use_min_zoom_level": true
}