{
  "background_color": "hsl(0, 100%, 96%)",
  "fetch_parts_of_linked_entities": true,
  "osm_filter_tags": [
    "architect:wikidata",
    "architect",
    "building",
    "tourism",
    "historic",
    "bridge",
    "site",
    "place=square"
  ],
  "osm_text_key": "architect",
  "osm_wikidata_keys": [
    "architect:wikidata"
  ],
  "osm_wikidata_properties": [
    "P84",
    "P287"
  ],
  "relation_propagation_type": "site",
  "require_wikidata_link": true,
  "use_min_zoom_level": true
}